{
  "$schema": "https://json-schema.org/draft/2020-12/schema",
  "$id": "urn:dumbmoney:schema:release-manifest:v1",
  "title": "DumbMoney immutable Windows release manifest",
  "type": "object",
  "additionalProperties": false,
  "required": [
    "schema_version",
    "release_id",
    "created_at",
    "release_state",
    "immutable",
    "broker_actions_authorized",
    "distribution",
    "hosted_control_plane",
    "remote_updates_authorized",
    "cloud_secret_storage_authorized",
    "telemetry_publication",
    "fund_lock",
    "services_manifest",
    "installed_artifacts",
    "command_bindings",
    "files"
  ],
  "properties": {
    "schema_version": {
      "const": "dumbmoney.release-manifest.v1"
    },
    "release_id": {
      "type": "string"
    },
    "created_at": {
      "type": "string",
      "format": "date-time"
    },
    "release_state": {
      "enum": [
        "TEMPLATE",
        "SEALED"
      ]
    },
    "immutable": {
      "const": true
    },
    "broker_actions_authorized": {
      "const": false
    },
    "distribution": {
      "const": "PRIVATE_LOCAL_ONLY"
    },
    "hosted_control_plane": {
      "const": false
    },
    "remote_updates_authorized": {
      "const": false
    },
    "cloud_secret_storage_authorized": {
      "const": false
    },
    "telemetry_publication": {
      "const": false
    },
    "fund_lock": {
      "$ref": "#/$defs/hashReference"
    },
    "services_manifest": {
      "$ref": "#/$defs/hashReference"
    },
    "installed_artifacts": {
      "type": "array",
      "minItems": 15,
      "maxItems": 15,
      "items": {
        "$ref": "#/$defs/installedArtifact"
      }
    },
    "command_bindings": {
      "type": "object",
      "additionalProperties": false,
      "required": [
        "DUMBMONEY_CORE_COMMAND",
        "DUMBMONEY_RESEARCH_MESH_COMMAND",
        "DUMBMONEY_MODEL_GATEWAY_COMMAND",
        "DUMBMONEY_DUMMY_KALSHI_COMMAND",
        "DUMBMONEY_DOPEY_ROBINHOOD_COMMAND"
      ],
      "properties": {
        "DUMBMONEY_CORE_COMMAND": {
          "$ref": "#/$defs/commandBinding"
        },
        "DUMBMONEY_RESEARCH_MESH_COMMAND": {
          "$ref": "#/$defs/commandBinding"
        },
        "DUMBMONEY_MODEL_GATEWAY_COMMAND": {
          "$ref": "#/$defs/commandBinding"
        },
        "DUMBMONEY_DUMMY_KALSHI_COMMAND": {
          "$ref": "#/$defs/commandBinding"
        },
        "DUMBMONEY_DOPEY_ROBINHOOD_COMMAND": {
          "$ref": "#/$defs/commandBinding"
        }
      }
    },
    "files": {
      "type": "array",
      "items": {
        "type": "object",
        "additionalProperties": false,
        "required": [
          "path",
          "sha256",
          "bytes",
          "component"
        ],
        "properties": {
          "path": {
            "type": "string"
          },
          "sha256": {
            "type": "string"
          },
          "bytes": {
            "type": "integer",
            "minimum": 0
          },
          "component": {
            "enum": [
              "blunder",
              "dummy",
              "dopey",
              "doofus",
              "waterboy",
              "nimrod",
              "dimwit"
            ]
          }
        }
      }
    }
  },
  "$defs": {
    "installedArtifact": {
      "type": "object",
      "additionalProperties": false,
      "required": [
        "name",
        "state",
        "source_path",
        "install_path",
        "sha256",
        "bytes",
        "component"
      ],
      "properties": {
        "name": {
          "enum": [
            "core-runner-config",
            "risk-policy",
            "core-public-key",
            "role-public-key-bundle",
            "research-mesh-runner-config",
            "research-mesh-public-key",
            "research-mesh-allocator-public-key",
            "model-gateway-runner-config",
            "model-gateway-public-key",
            "dopey-robinhood-runner-config",
            "dopey-codex-executable",
            "dopey-ollama-executable",
            "dopey-ollama-runtime-evidence",
            "dummy-kalshi-runner-config",
            "desktop-executable"
          ]
        },
        "state": {
          "enum": [
            "TEMPLATE",
            "SEALED"
          ]
        },
        "source_path": {
          "type": "string"
        },
        "install_path": {
          "type": "string"
        },
        "sha256": {
          "type": "string"
        },
        "bytes": {
          "type": "integer",
          "minimum": 0
        },
        "component": {
          "enum": [
            "blunder",
            "dummy",
            "dopey"
          ]
        }
      }
    },
    "commandBinding": {
      "type": "object",
      "additionalProperties": false,
      "required": [
        "executable",
        "sha256",
        "bytes",
        "component",
        "arguments"
      ],
      "properties": {
        "executable": {
          "type": "string"
        },
        "sha256": {
          "type": "string"
        },
        "bytes": {
          "type": "integer",
          "minimum": 0
        },
        "component": {
          "enum": [
            "blunder",
            "dummy",
            "dopey",
            "doofus",
            "waterboy",
            "nimrod",
            "dimwit"
          ]
        },
        "arguments": {
          "type": "array",
          "items": {
            "type": "string"
          }
        }
      }
    },
    "hashReference": {
      "type": "object",
      "additionalProperties": false,
      "required": [
        "path",
        "sha256"
      ],
      "properties": {
        "path": {
          "type": "string"
        },
        "sha256": {
          "type": "string"
        }
      }
    }
  }
}
