{
  "schema_version": "dumbmoney.release-manifest.v1",
  "release_id": "dumbmoney-windows-v1-template",
  "created_at": "2026-07-26T00:00:00Z",
  "release_state": "TEMPLATE",
  "immutable": true,
  "broker_actions_authorized": false,
  "distribution": "PRIVATE_LOCAL_ONLY",
  "hosted_control_plane": false,
  "remote_updates_authorized": false,
  "cloud_secret_storage_authorized": false,
  "telemetry_publication": false,
  "fund_lock": {
    "path": "deployment/dumbmoney/fund.lock.template.json",
    "sha256": "1b4f64e9764d85cc62a030906aaad72d8f0585e78244de63dcb0f152b0427c95"
  },
  "services_manifest": {
    "path": "deployment/dumbmoney/services.v1.json",
    "sha256": "a7bd3c83a1744de6fbd5f8c5862909195fda5e7f5a96df7d4e7f16cd20e82a39"
  },
  "installed_artifacts": [
    {
      "name": "core-runner-config",
      "state": "TEMPLATE",
      "source_path": "deployment/dumbmoney/core-runner.v1.template.json",
      "install_path": "C:\\ProgramData\\DumbMoney\\config\\core-runner.v1.json",
      "sha256": "be2ab3641f0c739132d0fc388032939b0a5c847cfdbd46247e183b2e768a1bcc",
      "bytes": 2272,
      "component": "blunder"
    },
    {
      "name": "risk-policy",
      "state": "TEMPLATE",
      "source_path": "configs/dumbmoney/risk-policy.v1.json",
      "install_path": "C:\\Program Files\\DumbMoney\\releases\\TO_BE_RESOLVED\\configs\\dumbmoney\\risk-policy.v1.json",
      "sha256": "4d4845930c3f2c2b3e2844317b8eb25f9d7ea0846b40830b452b49a2df6361bf",
      "bytes": 576,
      "component": "blunder"
    },
    {
      "name": "core-public-key",
      "state": "TEMPLATE",
      "source_path": "TO_BE_RESOLVED",
      "install_path": "C:\\ProgramData\\DumbMoney\\core\\keys\\core-ed25519.pub",
      "sha256": "TO_BE_RESOLVED",
      "bytes": 0,
      "component": "blunder"
    },
    {
      "name": "role-public-key-bundle",
      "state": "TEMPLATE",
      "source_path": "deployment/dumbmoney/role-public-keys.v1.template.json",
      "install_path": "C:\\Program Files\\DumbMoney\\releases\\TO_BE_RESOLVED\\configs\\dumbmoney\\role-public-keys.v1.json",
      "sha256": "87864da4d38ff83a9292eb9477f07455dc475328c96b47a28b2e99910aa2ae49",
      "bytes": 677,
      "component": "blunder"
    },
    {
      "name": "research-mesh-runner-config",
      "state": "TEMPLATE",
      "source_path": "TO_BE_RESOLVED",
      "install_path": "C:\\ProgramData\\DumbMoney\\config\\research-mesh-runner.v1.json",
      "sha256": "TO_BE_RESOLVED",
      "bytes": 0,
      "component": "blunder"
    },
    {
      "name": "research-mesh-public-key",
      "state": "TEMPLATE",
      "source_path": "TO_BE_RESOLVED",
      "install_path": "C:\\ProgramData\\DumbMoney\\research\\keys\\research-mesh-ed25519.pub",
      "sha256": "TO_BE_RESOLVED",
      "bytes": 0,
      "component": "blunder"
    },
    {
      "name": "research-mesh-allocator-public-key",
      "state": "TEMPLATE",
      "source_path": "TO_BE_RESOLVED",
      "install_path": "C:\\ProgramData\\DumbMoney\\research\\keys\\allocator-ed25519.pub",
      "sha256": "TO_BE_RESOLVED",
      "bytes": 0,
      "component": "blunder"
    },
    {
      "name": "model-gateway-runner-config",
      "state": "TEMPLATE",
      "source_path": "TO_BE_RESOLVED",
      "install_path": "C:\\ProgramData\\DumbMoney\\config\\model-gateway-runner.v1.json",
      "sha256": "TO_BE_RESOLVED",
      "bytes": 0,
      "component": "blunder"
    },
    {
      "name": "dopey-robinhood-runner-config",
      "state": "TEMPLATE",
      "source_path": "TO_BE_RESOLVED",
      "install_path": "C:\\ProgramData\\DumbMoney\\config\\dopey-robinhood-runner.v1.json",
      "sha256": "TO_BE_RESOLVED",
      "bytes": 0,
      "component": "dopey"
    },
    {
      "name": "dopey-codex-executable",
      "state": "TEMPLATE",
      "source_path": "TO_BE_RESOLVED",
      "install_path": "C:\\Program Files\\DumbMoney\\releases\\TO_BE_RESOLVED\\tools\\codex\\codex.exe",
      "sha256": "TO_BE_RESOLVED",
      "bytes": 0,
      "component": "dopey"
    },
    {
      "name": "dopey-ollama-executable",
      "state": "TEMPLATE",
      "source_path": "TO_BE_RESOLVED",
      "install_path": "C:\\Program Files\\DumbMoney\\releases\\TO_BE_RESOLVED\\tools\\ollama\\ollama.exe",
      "sha256": "TO_BE_RESOLVED",
      "bytes": 0,
      "component": "dopey"
    },
    {
      "name": "dopey-ollama-runtime-evidence",
      "state": "TEMPLATE",
      "source_path": "deployment/dumbmoney/ollama-runtime-evidence.v1.template.json",
      "install_path": "C:\\ProgramData\\DumbMoney\\dopey-robinhood\\evidence\\ollama-runtime-evidence.v1.json",
      "sha256": "8724eb499440c8dfb955d4ee77068776f63e38f9b2319a6cc636001bc9c3e789",
      "bytes": 1871,
      "component": "dopey"
    },
    {
      "name": "model-gateway-public-key",
      "state": "TEMPLATE",
      "source_path": "TO_BE_RESOLVED",
      "install_path": "C:\\ProgramData\\DumbMoney\\model-gateway\\keys\\gateway-ed25519.pub",
      "sha256": "TO_BE_RESOLVED",
      "bytes": 0,
      "component": "blunder"
    },
    {
      "name": "dummy-kalshi-runner-config",
      "state": "TEMPLATE",
      "source_path": "TO_BE_RESOLVED",
      "install_path": "C:\\ProgramData\\DumbMoney\\config\\dummy-kalshi-runner.v1.json",
      "sha256": "TO_BE_RESOLVED",
      "bytes": 0,
      "component": "dummy"
    },
    {
      "name": "desktop-executable",
      "state": "TEMPLATE",
      "source_path": "TO_BE_RESOLVED",
      "install_path": "C:\\Program Files\\DumbMoney\\releases\\TO_BE_RESOLVED\\desktop\\DumbMoney.exe",
      "sha256": "TO_BE_RESOLVED",
      "bytes": 0,
      "component": "blunder"
    }
  ],
  "command_bindings": {
    "DUMBMONEY_CORE_COMMAND": {
      "executable": "TO_BE_RESOLVED",
      "sha256": "TO_BE_RESOLVED",
      "bytes": 0,
      "component": "blunder",
      "arguments": [
        "--config",
        "C:\\ProgramData\\DumbMoney\\config\\core-runner.v1.json",
        "--config-sha256",
        "be2ab3641f0c739132d0fc388032939b0a5c847cfdbd46247e183b2e768a1bcc"
      ]
    },
    "DUMBMONEY_RESEARCH_MESH_COMMAND": {
      "executable": "TO_BE_RESOLVED",
      "sha256": "TO_BE_RESOLVED",
      "bytes": 0,
      "component": "blunder",
      "arguments": [
        "--config",
        "C:\\ProgramData\\DumbMoney\\config\\research-mesh-runner.v1.json",
        "--config-sha256",
        "TO_BE_RESOLVED"
      ]
    },
    "DUMBMONEY_MODEL_GATEWAY_COMMAND": {
      "executable": "TO_BE_RESOLVED",
      "sha256": "TO_BE_RESOLVED",
      "bytes": 0,
      "component": "blunder",
      "arguments": [
        "--config",
        "C:\\ProgramData\\DumbMoney\\config\\model-gateway-runner.v1.json",
        "--config-sha256",
        "TO_BE_RESOLVED"
      ]
    },
    "DUMBMONEY_DUMMY_KALSHI_COMMAND": {
      "executable": "TO_BE_RESOLVED",
      "sha256": "TO_BE_RESOLVED",
      "bytes": 0,
      "component": "dummy",
      "arguments": [
        "--core-endpoint-ref",
        "endpoint-ref:DumbMoneyCore",
        "--core-cell-token-target",
        "credential-target:DumbMoney/DummyCellToken",
        "--kalshi-key-id-target",
        "credential-target:DumbMoney/KalshiApiKeyId",
        "--kalshi-private-key-target",
        "credential-target:DumbMoney/KalshiPrivateKeyPem",
        "--readiness-signing-key-target",
        "credential-target:DumbMoney/DummyReadinessEd25519",
        "--start-mode",
        "RECONCILIATION_ONLY",
        "--readiness-ref",
        "readiness-ref:DumbMoneyDummyKalshi",
        "--config-sha256",
        "TO_BE_RESOLVED"
      ]
    },
    "DUMBMONEY_DOPEY_ROBINHOOD_COMMAND": {
      "executable": "TO_BE_RESOLVED",
      "sha256": "TO_BE_RESOLVED",
      "bytes": 0,
      "component": "dopey",
      "arguments": [
        "--core-endpoint-ref",
        "endpoint-ref:DumbMoneyCore",
        "--core-cell-token-target",
        "credential-target:DumbMoney/DopeyCellToken",
        "--robinhood-profile-target",
        "credential-target:DumbMoney/RobinhoodProfile",
        "--start-mode",
        "RECONCILIATION_ONLY",
        "--readiness-ref",
        "readiness-ref:DumbMoneyDopeyRobinhood",
        "--config-sha256",
        "TO_BE_RESOLVED"
      ]
    }
  },
  "files": [
    {
      "path": "configs/dumbmoney/dopey-robinhood-runner.v1.template.json",
      "sha256": "48561576e3089df0f66c4e0661117826042f4ac2c7c86f9876fbc2247a23d951",
      "bytes": 1867,
      "component": "dopey"
    },
    {
      "path": "configs/dumbmoney/dummy-kalshi-runner.v1.template.json",
      "sha256": "7b169585f5a265915b2dd4785ad1379c466c074e34f68aa5d08c98a7fa94a17d",
      "bytes": 2452,
      "component": "dummy"
    },
    {
      "path": "configs/dumbmoney/fixtures/signed-capital-envelope.v1.json",
      "sha256": "b0fe2fa0261b2dc36e4043e8c33b91b1016676e04a25e4b4d5bd66eea0c9079a",
      "bytes": 2132,
      "component": "blunder"
    },
    {
      "path": "configs/dumbmoney/risk-policy.v1.json",
      "sha256": "4d4845930c3f2c2b3e2844317b8eb25f9d7ea0846b40830b452b49a2df6361bf",
      "bytes": 576,
      "component": "blunder"
    },
    {
      "path": "configs/dumbmoney/schemas/capital-envelope.v1.schema.json",
      "sha256": "ef43b9b5a82e4d86c4d56e82cd58a6ad281e0cd831798379dbf47a88046bed34",
      "bytes": 2954,
      "component": "blunder"
    },
    {
      "path": "configs/dumbmoney/schemas/capital-request.v1.schema.json",
      "sha256": "0455d9f456c3b508dfd2c0b1e14e224719feeb64fe4992d68d19f0b8acea6eb8",
      "bytes": 3055,
      "component": "blunder"
    },
    {
      "path": "configs/dumbmoney/schemas/cell-command-page.v1.schema.json",
      "sha256": "3a8efdaf8747432f0951c4800c5f42eaa48d7abb14f89153c211621697daa73d",
      "bytes": 8412,
      "component": "blunder"
    },
    {
      "path": "configs/dumbmoney/schemas/cell-contract-resolution.v1.schema.json",
      "sha256": "93977ad547c1ba2b08e24fd9eed3b34889629ef28611688f96b3ee90fccf81c5",
      "bytes": 10373,
      "component": "blunder"
    },
    {